[
 {
  "id": "hull_upper_front",
  "zone": "hull_upper_front",
  "material": "rha",
  "thickness_mm": 63.5,
  "center": {
   "x": 0.0,
   "y": 1.48,
   "z": 2.6218
  },
  "normal": {
   "x": 0.0,
   "y": 0.7314,
   "z": 0.682
  },
  "axis_u": {
   "x": 1.0,
   "y": 0.0,
   "z": 0.0
  },
  "half_u": 1.31,
  "half_v": 0.4692
 },
 {
  "id": "hull_lower_front",
  "zone": "hull_lower_front",
  "material": "cha",
  "thickness_mm": 108,
  "center": {
   "x": 0.0,
   "y": 0.795,
   "z": 2.8322
  },
  "normal": {
   "x": 0.0,
   "y": -0.342,
   "z": 0.9397
  },
  "axis_u": {
   "x": 1.0,
   "y": 0.0,
   "z": 0.0
  },
  "half_u": 1.31,
  "half_v": 0.3884
 },
 {
  "id": "hull_side_r",
  "zone": "hull_side",
  "material": "rha",
  "thickness_mm": 38,
  "center": {
   "x": 1.31,
   "y": 1.115,
   "z": 0.0
  },
  "normal": {
   "x": 1.0,
   "y": 0.0,
   "z": 0.0
  },
  "axis_u": {
   "x": 0.0,
   "y": 0.0,
   "z": 1.0
  },
  "half_u": 2.815,
  "half_v": 0.685
 },
 {
  "id": "hull_side_l",
  "zone": "hull_side",
  "material": "rha",
  "thickness_mm": 38,
  "center": {
   "x": -1.31,
   "y": 1.115,
   "z": 0.0
  },
  "normal": {
   "x": -1.0,
   "y": 0.0,
   "z": 0.0
  },
  "axis_u": {
   "x": 0.0,
   "y": 0.0,
   "z": 1.0
  },
  "half_u": 2.815,
  "half_v": 0.685
 },
 {
  "id": "hull_rear",
  "zone": "hull_rear",
  "material": "rha",
  "thickness_mm": 38,
  "center": {
   "x": 0.0,
   "y": 1.115,
   "z": -2.8232
  },
  "normal": {
   "x": 0.0,
   "y": 0.2588,
   "z": -0.9659
  },
  "axis_u": {
   "x": 1.0,
   "y": 0.0,
   "z": 0.0
  },
  "half_u": 1.31,
  "half_v": 0.7092
 },
 {
  "id": "hull_roof",
  "zone": "hull_roof",
  "material": "rha",
  "thickness_mm": 19,
  "center": {
   "x": 0.0,
   "y": 1.8,
   "z": -0.3
  },
  "normal": {
   "x": 0.0,
   "y": 1.0,
   "z": 0.0
  },
  "axis_u": {
   "x": 1.0,
   "y": 0.0,
   "z": 0.0
  },
  "half_u": 1.31,
  "half_v": 2.065
 },
 {
  "id": "hull_floor",
  "zone": "hull_floor",
  "material": "rha",
  "thickness_mm": 25,
  "center": {
   "x": 0.0,
   "y": 0.43,
   "z": 0.0
  },
  "normal": {
   "x": 0.0,
   "y": -1.0,
   "z": 0.0
  },
  "axis_u": {
   "x": 1.0,
   "y": 0.0,
   "z": 0.0
  },
  "half_u": 1.01,
  "half_v": 2.665
 },
 {
  "id": "turret_front",
  "zone": "turret_front",
  "material": "cha",
  "thickness_mm": 76,
  "center": {
   "x": 0.0,
   "y": 2.175,
   "z": 1.22
  },
  "normal": {
   "x": 0.0,
   "y": 0.5,
   "z": 0.866
  },
  "axis_u": {
   "x": 1.0,
   "y": 0.0,
   "z": 0.0
  },
  "half_u": 1.1,
  "half_v": 0.375
 },
 {
  "id": "gun_mantlet",
  "zone": "gun_mantlet",
  "material": "cha",
  "thickness_mm": 89,
  "center": {
   "x": 0.0,
   "y": 2.1,
   "z": 1.31
  },
  "normal": {
   "x": 0.0,
   "y": 0.0,
   "z": 1.0
  },
  "axis_u": {
   "x": 1.0,
   "y": 0.0,
   "z": 0.0
  },
  "half_u": 0.55,
  "half_v": 0.3
 },
 {
  "id": "turret_side_r",
  "zone": "turret_side",
  "material": "cha",
  "thickness_mm": 51,
  "center": {
   "x": 1.08,
   "y": 2.175,
   "z": -0.1
  },
  "normal": {
   "x": 0.9962,
   "y": 0.0872,
   "z": 0.0
  },
  "axis_u": {
   "x": 0.0,
   "y": 0.0,
   "z": 1.0
  },
  "half_u": 1.35,
  "half_v": 0.3764
 },
 {
  "id": "turret_side_l",
  "zone": "turret_side",
  "material": "cha",
  "thickness_mm": 51,
  "center": {
   "x": -1.08,
   "y": 2.175,
   "z": -0.1
  },
  "normal": {
   "x": -0.9962,
   "y": 0.0872,
   "z": 0.0
  },
  "axis_u": {
   "x": 0.0,
   "y": 0.0,
   "z": 1.0
  },
  "half_u": 1.35,
  "half_v": 0.3764
 },
 {
  "id": "turret_rear",
  "zone": "turret_rear",
  "material": "cha",
  "thickness_mm": 51,
  "center": {
   "x": 0.0,
   "y": 2.175,
   "z": -1.42
  },
  "normal": {
   "x": 0.0,
   "y": 0.0,
   "z": -1.0
  },
  "axis_u": {
   "x": 1.0,
   "y": 0.0,
   "z": 0.0
  },
  "half_u": 1.1,
  "half_v": 0.375
 },
 {
  "id": "turret_roof",
  "zone": "turret_roof",
  "material": "rha",
  "thickness_mm": 25,
  "center": {
   "x": 0.0,
   "y": 2.55,
   "z": -0.1
  },
  "normal": {
   "x": 0.0,
   "y": 1.0,
   "z": 0.0
  },
  "axis_u": {
   "x": 1.0,
   "y": 0.0,
   "z": 0.0
  },
  "half_u": 1.0,
  "half_v": 1.25
 }
]
