[
 {
  "id": "hull_upper_front",
  "zone": "hull_upper_front",
  "material": "rha",
  "thickness_mm": 6,
  "center": {
   "x": 0.0,
   "y": 2.15,
   "z": 3.0043
  },
  "normal": {
   "x": 0.0,
   "y": 0.5,
   "z": 0.866
  },
  "axis_u": {
   "x": 1.0,
   "y": 0.0,
   "z": 0.0
  },
  "half_u": 1.1,
  "half_v": 0.9815
 },
 {
  "id": "hull_lower_front",
  "zone": "hull_lower_front",
  "material": "rha",
  "thickness_mm": 6,
  "center": {
   "x": 0.0,
   "y": 0.86,
   "z": 3.3349
  },
  "normal": {
   "x": 0.0,
   "y": -0.342,
   "z": 0.9397
  },
  "axis_u": {
   "x": 1.0,
   "y": 0.0,
   "z": 0.0
  },
  "half_u": 1.1,
  "half_v": 0.4682
 },
 {
  "id": "hull_side_r",
  "zone": "hull_side",
  "material": "rha",
  "thickness_mm": 4,
  "center": {
   "x": 1.1,
   "y": 1.0,
   "z": 0.0
  },
  "normal": {
   "x": 1.0,
   "y": 0.0,
   "z": 0.0
  },
  "axis_u": {
   "x": 0.0,
   "y": 0.0,
   "z": 1.0
  },
  "half_u": 3.345,
  "half_v": 0.53
 },
 {
  "id": "hull_side_l",
  "zone": "hull_side",
  "material": "rha",
  "thickness_mm": 4,
  "center": {
   "x": -1.1,
   "y": 1.0,
   "z": 0.0
  },
  "normal": {
   "x": -1.0,
   "y": 0.0,
   "z": 0.0
  },
  "axis_u": {
   "x": 0.0,
   "y": 0.0,
   "z": 1.0
  },
  "half_u": 3.345,
  "half_v": 0.53
 },
 {
  "id": "hull_rear",
  "zone": "hull_rear",
  "material": "rha",
  "thickness_mm": 4,
  "center": {
   "x": 0.0,
   "y": 1.71,
   "z": -3.445
  },
  "normal": {
   "x": 0.0,
   "y": 0.0,
   "z": -1.0
  },
  "axis_u": {
   "x": 1.0,
   "y": 0.0,
   "z": 0.0
  },
  "half_u": 1.1,
  "half_v": 1.29
 },
 {
  "id": "hull_roof",
  "zone": "hull_roof",
  "material": "rha",
  "thickness_mm": 3,
  "center": {
   "x": 0.0,
   "y": 3.0,
   "z": -0.3
  },
  "normal": {
   "x": 0.0,
   "y": 1.0,
   "z": 0.0
  },
  "axis_u": {
   "x": 1.0,
   "y": 0.0,
   "z": 0.0
  },
  "half_u": 1.1,
  "half_v": 2.595
 },
 {
  "id": "hull_floor",
  "zone": "hull_floor",
  "material": "rha",
  "thickness_mm": 4,
  "center": {
   "x": 0.0,
   "y": 0.42,
   "z": 0.0
  },
  "normal": {
   "x": 0.0,
   "y": -1.0,
   "z": 0.0
  },
  "axis_u": {
   "x": 1.0,
   "y": 0.0,
   "z": 0.0
  },
  "half_u": 0.8,
  "half_v": 3.195
 },
 {
  "id": "turret_front",
  "zone": "turret_front",
  "material": "rha",
  "thickness_mm": 6,
  "center": {
   "x": 0.0,
   "y": 2.44,
   "z": 0.49
  },
  "normal": {
   "x": 0.0,
   "y": 0.2588,
   "z": 0.9659
  },
  "axis_u": {
   "x": 1.0,
   "y": 0.0,
   "z": 0.0
  },
  "half_u": 1.3,
  "half_v": 0.85
 },
 {
  "id": "gun_mantlet",
  "zone": "gun_mantlet",
  "material": "rha",
  "thickness_mm": 6,
  "center": {
   "x": 0.0,
   "y": 2.77,
   "z": 0.58
  },
  "normal": {
   "x": 0.0,
   "y": 0.0,
   "z": 1.0
  },
  "axis_u": {
   "x": 1.0,
   "y": 0.0,
   "z": 0.0
  },
  "half_u": 0.4,
  "half_v": 0.5
 },
 {
  "id": "turret_side_r",
  "zone": "turret_side",
  "material": "rha",
  "thickness_mm": 1,
  "center": {
   "x": 1.09,
   "y": 2.7,
   "z": -0.3785
  },
  "normal": {
   "x": 0.9308,
   "y": -0.3655,
   "z": 0
  },
  "axis_u": {
   "x": 0.0,
   "y": 0.0,
   "z": 1.0
  },
  "half_u": 0.1875,
  "half_v": 0.6123
 },
 {
  "id": "turret_side_l",
  "zone": "turret_side",
  "material": "rha",
  "thickness_mm": 1,
  "center": {
   "x": -1.09,
   "y": 2.7,
   "z": -0.3785
  },
  "normal": {
   "x": -0.9308,
   "y": -0.3655,
   "z": 0
  },
  "axis_u": {
   "x": 0.0,
   "y": 0.0,
   "z": 1.0
  },
  "half_u": 0.1875,
  "half_v": 0.6123
 },
 {
  "id": "turret_rear",
  "zone": "turret_rear",
  "material": "rha",
  "thickness_mm": 1,
  "center": {
   "x": 0.0,
   "y": 2.44,
   "z": -1.65
  },
  "normal": {
   "x": 0.0,
   "y": 0.0,
   "z": -1.0
  },
  "axis_u": {
   "x": 1.0,
   "y": 0.0,
   "z": 0.0
  },
  "half_u": 1.3,
  "half_v": 0.85
 },
 {
  "id": "folding_cab_side_left",
  "zone": "hull_side",
  "material": "rha",
  "thickness_mm": 4,
  "center": {
   "x": -1.24446,
   "y": 2.10051,
   "z": 0.2875
  },
  "normal": {
   "x": -0.99993,
   "y": -0.01183,
   "z": 0.0
  },
  "axis_u": {
   "x": 0.0,
   "y": 0.0,
   "z": 1.0
  },
  "half_u": 0.7775000333786011,
  "half_v": 0.5706198050437143,
  "hinge": {
   "a": [
    -1.245,
    1.53,
    -0.49
   ],
   "b": [
    -1.245,
    1.53,
    1.065
   ],
   "angle": 90
  }
 },
 {
  "id": "folding_bed_front_left",
  "zone": "hull_side",
  "material": "rha",
  "thickness_mm": 4,
  "center": {
   "x": -1.30022,
   "y": 2.065,
   "z": -0.98
  },
  "normal": {
   "x": -0.99994,
   "y": -0.01134,
   "z": 0.0
  },
  "axis_u": {
   "x": 0.0,
   "y": 0.0,
   "z": 1.0
  },
  "half_u": 0.49000000953674316,
  "half_v": 0.48509350608123636,
  "hinge": {
   "a": [
    -1.3,
    1.58,
    -1.47
   ],
   "b": [
    -1.3,
    1.58,
    -0.49
   ],
   "angle": 90
  }
 },
 {
  "id": "folding_bed_rear_left",
  "zone": "hull_side",
  "material": "rha",
  "thickness_mm": 4,
  "center": {
   "x": -1.31562,
   "y": 1.80498,
   "z": -2.415
  },
  "normal": {
   "x": -0.99964,
   "y": -0.02666,
   "z": 0.0
  },
  "axis_u": {
   "x": 0.0,
   "y": 0.0,
   "z": 1.0
  },
  "half_u": 0.9249999523162842,
  "half_v": 0.22523989412476741,
  "hinge": {
   "a": [
    -1.315,
    1.58,
    -3.34
   ],
   "b": [
    -1.315,
    1.58,
    -1.49
   ],
   "angle": 90
  }
 },
 {
  "id": "folding_cab_side_right",
  "zone": "hull_side",
  "material": "rha",
  "thickness_mm": 4,
  "center": {
   "x": 1.24554,
   "y": 2.10051,
   "z": 0.2875
  },
  "normal": {
   "x": 0.99993,
   "y": 0.01183,
   "z": -0.0
  },
  "axis_u": {
   "x": 0.0,
   "y": 0.0,
   "z": 1.0
  },
  "half_u": 0.7775000333786011,
  "half_v": 0.5706198049873082,
  "hinge": {
   "a": [
    1.245,
    1.53,
    -0.49
   ],
   "b": [
    1.245,
    1.53,
    1.065
   ],
   "angle": -90
  }
 },
 {
  "id": "folding_bed_front_right",
  "zone": "hull_side",
  "material": "rha",
  "thickness_mm": 4,
  "center": {
   "x": 1.29978,
   "y": 2.065,
   "z": -0.98
  },
  "normal": {
   "x": 0.99994,
   "y": 0.01134,
   "z": -0.0
  },
  "axis_u": {
   "x": 0.0,
   "y": 0.0,
   "z": 1.0
  },
  "half_u": 0.49000000953674316,
  "half_v": 0.4850935059460769,
  "hinge": {
   "a": [
    1.3,
    1.58,
    -1.47
   ],
   "b": [
    1.3,
    1.58,
    -0.49
   ],
   "angle": -90
  }
 },
 {
  "id": "folding_bed_rear_right",
  "zone": "hull_side",
  "material": "rha",
  "thickness_mm": 4,
  "center": {
   "x": 1.31438,
   "y": 1.80498,
   "z": -2.415
  },
  "normal": {
   "x": 0.99964,
   "y": 0.02666,
   "z": -0.0
  },
  "axis_u": {
   "x": 0.0,
   "y": 0.0,
   "z": 1.0
  },
  "half_u": 0.9249999523162842,
  "half_v": 0.22523989418827817,
  "hinge": {
   "a": [
    1.315,
    1.58,
    -3.34
   ],
   "b": [
    1.315,
    1.58,
    -1.49
   ],
   "angle": -90
  }
 }
]
